{
  "schemaVersion": 1,
  "id": "miku-aqua-stage",
  "name": "初音未来 · 未来青",
  "paletteId": "miku-aqua",
  "paletteName": "初音未来 · 未来青",
  "backgroundName": "内置抽象背景",
  "layoutId": "stage",
  "visualStyle": "miku-07",
  "brandSubtitle": "MIKU CODEX",
  "tagline": "和初音未来一起，把灵感写成可以运行的代码。",
  "projectPrefix": "选择舞台 · ",
  "projectLabel": "♪  选择项目",
  "statusText": "MIKU STAGE ONLINE",
  "quote": "BE TOGETHER, BE FUTURE",
  "image": "background.png",
  "effects": {
    "taskPanelOpacity": 0.76,
    "taskPanelBlur": 14
  },
  "colors": {
    "background": "#eafcff",
    "panel": "#ffffff",
    "panelAlt": "#f2fbff",
    "accent": "#39c5bb",
    "accentAlt": "#68e3d9",
    "secondary": "#58c9ee",
    "highlight": "#ff6f91",
    "text": "#173344",
    "muted": "#657d8b",
    "line": "rgba(57, 197, 187, .30)"
  }
}
